id,"title","image_url","director","detail","open_date","created_at","updated_at"
217,"マイ・ファニー・レディ","http://image.eiga.k-img.com/images/movie/81148/poster2/200.jpg?1447988897","ピーター・ボグダノビッチ","「ペーパームーン」「ラスト・ショー」の名匠ピーター・ボグダノビッチ監督が、長編劇映画としては約13年ぶりに手がけた群像コメディ。自身の妻を主役にした舞台を控える演出家がコールガールと一夜を共にするが、実は彼女は女優の卵で、舞台のオーディションに合格したことから思いも寄らぬ騒動が巻き起こる。オーウェン・ウィルソンが主人公の演出家アーノルドを演じ、イモージェン・プーツ、ジェニファー・アニストンが共演。2014年・第27回東京国際映画祭ワールド・フォーカス部門では「シーズ・ファニー・ザット・ウェイ」のタイトルで上映されている。","2015年12月19日","2017-02-20 09:49:19","2017-02-20 09:49:19"
218,"A Film About Coffee ア・フィルム・アバウト・コーヒー","http://image.eiga.k-img.com/images/movie/82814/poster2/200.jpg?1447398845","ブランドン・ローパー","2015年に米ブルーボトルコーヒーが世界初進出の第1号店として東京に店舗を構えるなど、近年、世界的な広がりや盛り上がりを見せる本格志向のコーヒーカルチャー。現在のコーヒー文化を牽引する、ニューヨーク、サンフランシスコ、ポートランド、シアトル、東京の5つの都市で活躍するコーヒー店オーナーらプロフェッショナルたちのコーヒーへの哲学や仕事ぶりなどを追った。日本にも進出したサンフランシスコの「ブルーボトル・コーヒー」創設者ジェームス・フリーマン氏をはじめ、2013年に閉店した表参道の「大坊珈琲店」オーナー・大坊勝次氏、下北沢の「Bear Pond Espresso」オーナー・田中勝幸氏、表参道の「OMOTESANDO KOFFEE」オーナー・國友栄一氏ら、東京で活躍するコーヒーの達人たちも登場。コーヒーの「求道者」とも言える彼らのこだわり、コーヒーへの思いが描かれる。監督はサンフランシスコ在住のCMクリエイター、ブランドン・ローパー。","2015年12月12日","2017-02-20 09:49:19","2017-02-20 09:49:19"
219,"COMET コメット","http://image.eiga.k-img.com/images/movie/83182/poster2/200.jpg?1447295898","サム・エスメイル","ある恋人たちの6年間にわたる会話の数々を「時間」と「空間」を巧みに利用し、ランダムに切り取りながら展開していくラブストーリー。彗星が降る夜、デルとキンバリーは恋に落ちた。2人が出会った公園、再開の列車、パリのホテル、あの夜から始まった2人の6年間がめまぐるしく描写されていく。そして、キンバリーのある告白が、デルに衝撃を与える。キンバリーに一目ぼれをするデルを演じるのは「そんな彼なら捨てちゃえば？」「ダイ・ハード4.0」のジャスティン・ロング。ヒロインのキンバリー役に「オペラ座の怪人」「サヨナラの代わりに」のエミー・ロッサム。監督はテレビドラマ「ミスター・ロボット」を手がけ、本作品が長編監督デビューとなるサム・エスメイル。","2015年12月12日","2017-02-20 09:49:19","2017-02-20 09:49:19"
220,"創造と神秘のサグラダ・ファミリア","http://image.eiga.k-img.com/images/movie/81607/poster2/200.jpg?1441592372","ステファン・ハウプト","スペイン、カタルーニャ出身の建築家アントニ・ガウディが構想し、1882年の着工から130年以上も建設が続く世紀の建築プロジェクト「サグラダ・ファミリア」のドキュメンタリー。2005年には世界遺産にも登録され、世界から訪れる年間300万人を超える人々を魅了し続けているサグラダ・ファミリア。2026年完成予定に向けて建設が続く中、現場にはコンピューターも導入され、現在の技術でガウディの意思をいかに再現するか、スタッフの試行錯誤が繰り返されている。関係者でなければ入れない内部の映像や建築関係者のインタビューも交えて描き、「完成まで300年」と言われた工期がいかに短縮され、2026年完成予定となったのかなど、サグラダ・ファミリアにまつわるプロジェクトを解明していく。","2015年12月12日","2017-02-20 09:49:20","2017-02-20 09:49:20"
221,"母と暮せば","http://image.eiga.k-img.com/images/movie/81537/200x133.jpg?1452251269","山田洋次","小説家・劇作家の井上ひさしが、広島を舞台にした自身の戯曲「父と暮せば」と対になる作品として実現を願いながらもかなわなかった物語を、日本映画界を代表する名匠・山田洋次監督が映画化。主人公の福原伸子役を「おとうと」「母べえ」でも山田監督とタッグを組んだ吉永小百合が演じ、その息子・浩二役で二宮和也が山田組に初参加。「小さいおうち」でベルリン国際映画祭銀獅子賞（女優賞）を受賞した黒木華が、浩二の恋人・町子に扮する。1948年8月9日、長崎で助産婦をして暮らす伸子の前に、3年前に原爆で死んだはずの息子・浩二が現れる。2人は浩二の恋人・町子の幸せを気にかけながら、たくさんの話をする。その幸せな時間は永遠に続くと思われたが……。","2015年12月12日","2017-02-20 09:50:40","2017-02-20 09:50:40"
222,"海難1890","http://image.eiga.k-img.com/images/movie/79893/poster2/200.jpg?1443071656","田中光敏","日本とトルコの友好関係の礎となったエルトゥールル号遭難事件を題材に、日本・トルコ合作で映画化したヒューマンドラマ。1890年9月、オスマン帝国の親善訪日使節団を乗せた軍艦エルトゥールル号が和歌山県沖で座礁し、乗組員618人が荒れ狂う海へと投げ出された。500人以上もの犠牲者が出る中、地元住民の懸命な救助活動によって69人の命が救われ、トルコへ帰還。この事件をきっかけに、日本とトルコの間に厚い友情が結ばれることとなった。そして1985年、イラン・イラク戦争で緊張が高まるテヘランに日本人215人が取り残され、日本大使館はトルコに救出を依頼する。「家路」「臨場」の内野聖陽が、エルトゥールル号乗組員の介抱に奔走する医師役で主演。ヒロイン役の忽那汐里はそれぞれの時代に生きる女性を1人2役で演じた。監督は「利休にたずねよ」「化粧師 KEWAISHI」の田中光敏。","2015年12月5日","2017-02-20 09:50:41","2017-02-20 09:50:41"
223,"写真家ソール・ライター　急がない人生で見つけた13のこと","http://image.eiga.k-img.com/images/movie/82440/poster2/200.jpg?1444877986","トーマス・リーチ","伝説の写真家ソール・ライターの半生を追ったドキュメンタリー。1923年、米ピッツバーグに生まれた写真家のライターは、絵画のように豊かな表現力でニューヨークを撮影したカラー写真の先駆者として40年代から活躍し、「ハーパースバザー」や「ヴォーグ」といった有名ファッション誌の表紙も飾ったが、写真に芸術性よりも商業性が求められるようになった80年代、表舞台から姿を消してしまう。それから時を経た2006年、写真集の印刷に定評のあるドイツのシュタイデル社から初の写真集が発表され、80歳を超えた「巨匠の再発見」に世界が沸いた。「人生で大切なのは、何を捨てるかということ」という持論で、あえて名声から遠ざかるように歩んできたライターの人生を通し、彼の作品が見る者の心を打つ理由を探る。","2015年12月5日","2017-02-20 09:50:41","2017-02-20 09:50:41"
224,"技術者たち","http://image.eiga.k-img.com/images/movie/82588/poster2/200.jpg?1444120367","キム・ホンソン","壮大な現金強奪計画に挑む男たちの奮闘を描いた韓国製クライムアクション。凄腕の金庫破りにして詐欺師のジヒョクは、人材調達を得意とするグインや天才ハッカーのジョンベらと組んで宝石店を襲い、裏社会に名を馳せる。そんな彼らに財界の大物チョ社長がある仕事を依頼する。それは、北東アジア最高のセキュリティを誇る仁川税関に隠された1500億ウォンもの大金を、わずか40分の制限時間内に盗み出すというものだった。出演は「チング　永遠の絆」のキム・ウビン、「シークレット・ミッション」のイ・ヒョヌ、「朝鮮美女三銃士」のコ・チャンソク。「共謀者」のキム・ホンソンがメガホンをとった。","2015年11月28日","2017-02-20 09:50:41","2017-02-20 09:50:41"
225,"黄金のアデーレ　名画の帰還","http://image.eiga.k-img.com/images/movie/81867/poster2/200.jpg?1440641416","サイモン・カーティス","グスタフ・クリムトが描いた世界的名画「黄金のアデーレ」をめぐって実際に起こった裁判と「黄金のアデーレ」に秘められた数奇な物語を、アカデミー賞女優ヘレン・ミレン主演で描いた。アメリカに住む82歳のマリア・アルトマンがオーストリア政府を相手に裁判を起こした。世界中を驚かせたその裁判は、クリムトが描いたマリアの叔母アデーレの肖像画「黄金のアデーレ」の返還要求だった。ナチス統治下のオーストリアで、ナチスによって奪われたその名画には、マリア自身と彼女を取り巻く人々のさまざまな記憶が詰まっていた。マリアとともに裁判を起こす駆け出し弁護士役にライアン・レイノルズ。ダニエル・ブリュール、ケイティ・ホームズが脇を固める。監督は「マリリン 7日間の恋」のサイモン・カーティス。","2015年11月27日","2017-02-20 09:50:42","2017-02-20 09:50:42"
226,"ガールズ＆パンツァー　劇場版","http://image.eiga.k-img.com/images/movie/78660/poster2/200.jpg?1443776823","水島努","2012～13年にかけてテレビ放送され、14年には新作OVAも劇場上映された「ガールズ＆パンツァー」の完全新作劇場版。戦車を用いた武芸「戦車道」が大和撫子のたしなみとされる世界を舞台に、戦車道に打ち込む女子高生たちの成長や友情を描いた人気アニメで、テレビシリーズで戦車道の全国大会を戦い抜いた、西住みほを中心とした県立大洗女子学園のその後の物語が描かれる。第63回戦車道全国大会で優勝を飾った大洗女子学園。平穏な日常が戻ってきたと思っていたある日、大洗でエキシビジョンマッチが開催されることになる。いまやすっかり町の人気者になった大洗女子戦車道チームには熱い視線が注がれるが……。監督の水島努、脚本の吉田玲子、キャラクター原案の島田フミカネらこれまででおなじみのスタッフが集う。","2015年11月21日","2017-02-20 09:50:42","2017-02-20 09:50:42"
227,"放浪の画家ピロスマニ","http://image.eiga.k-img.com/images/movie/48484/poster2/200.jpg?1442544678","ゲオルギー・シェンゲラーヤ","グルジア（ジョージア）を代表する画家ニコ・ピロスマニの半生を描いた伝記映画。幼くして両親を亡くしたピロスマニは、店の看板や壁に飾る絵を描きながら放浪の日々を送るようになる。人々に一目置かれるようになっていくピロスマニだったが、酒場で見初めた踊り子マルガリータへの報われない愛が、画家を孤独な生活へと追い込んでいく。ロシア革命前夜、一杯の酒を得るため画材をかかえて居酒屋を渡り歩く生活を送っていたピロスマニは、作品がある芸術家の眼にとまったことをきっかけに、中央の画壇に注目されるようになる。グルジアがソ連の構成国だった1969年製作。日本では78年に「ピロスマニ」のタイトルでロシア語吹き替え版が劇場公開された。2015年、邦題「放浪の画家ピロスマニ」として、デジタルリマスター＆グルジア語オリジナル版で37年ぶりに劇場公開。","2015年11月21日","2017-02-20 09:50:42","2017-02-20 09:50:42"
228,"ゆめのほとり　認知症グループホーム　福寿荘","http://image.eiga.k-img.com/images/movie/83097/poster2/200.jpg?1443149736","伊勢真一","北海道札幌市にある認知症グループホーム「福寿荘」の日常を記録したドキュメンタリー作品。「一人を大切に」「支え合う心」「安心して暮らせる社会づくり」をモットーに、2000年に開所された「福寿荘」で生活をするさまざまな症状を持つ認知症の人々。医学的な知識や社会制度など、認知症に関する説明を説くのではなく、認知症の人たちの日常を淡々とカメラで追うことで、認知症、ケア、そして「生きる」ということを見る者に訴えかける。監督は「妻の病　レビー小体型認知症」「大丈夫。　小児科医・細谷亮太のコトバ」など、人や命に寄り添ったドキュメンタリーを作り続けている伊勢真一。","2015年11月21日","2017-02-20 09:50:43","2017-02-20 09:50:43"
229,"パリ3区の遺産相続人","http://image.eiga.k-img.com/images/movie/82702/poster2/200.jpg?1439949751","イスラエル・ホロビッツ","父のアパートを相続した男と、そのアパートに住み続ける老婦人の出会いを通し、家族の秘密が明らかとなるヒューマンストーリー。ニューヨークに住む一文無しのマティアスは父親から相続した高級アパートを売却し、その金で人生のやり直そうとパリへとやって来た。しかし、そのアパートには見知らぬ90歳の老婦人マティルドが娘のクロエとともに住んでいた。マティルドと父が交わした契約は、住宅ローンの代わりに売主に毎月年金を払う「ヴィアジェ」という独特な売買システムで、ある一枚の写真をきっかけに、マティルドと父親の関係が徐々に明らかとなるが……。マティアス役にケビン・クライン、マティルド役にはマギー・スミス。マティルドの娘・クロエ役にクリスティン・スコット・トーマス。「いちご白書」「さらば青春の日」など脚本家として知られるイスラエル・ホロビッツの初監督作品。","2015年11月14日","2017-02-20 09:50:43","2017-02-20 09:50:43"
230,"FOUJITA","http://image.eiga.k-img.com/images/movie/81051/poster2/200.jpg?1435654894","小栗康平","1920年代からフランスを中心に活躍した日本人画家・藤田嗣治の半生を、オダギリジョー主演で映画化。「泥の河」「死の棘」の小栗康平監督が10年ぶりに手がけた長編監督作で、日本とフランスの合作映画として製作された。共演は中谷美紀、加瀬亮、岸部一徳ら。1913年、27歳で単身フランスへ渡ったフジタは、「乳白色の肌」で裸婦を描き、エコール・ド・パリの寵児となる。そして40年に帰国し、戦時下で戦争協力画を描くことになったフジタは、日本美術界の中で重鎮として登り詰めていくが、疎開先の村で敗戦を迎える。","2015年11月14日","2017-02-20 09:50:43","2017-02-20 09:50:43"
231,"劇場版 MOZU","http://image.eiga.k-img.com/images/movie/81409/poster2/200.jpg?1442453786","羽住英一郎","逢坂剛氏のハードボイルド小説「百舌」シリーズを原作に、TBSとWOWOWが共同製作、リレー形式で放送した人気ドラマ「MOZU」の劇場版。ドラマ版に続き、主演の西島秀俊や香川照之、真木よう子ら豪華キャストが出演し、最大の敵となる悪役ダルマにビートたけしが扮する。妻の死の謎を追っていた公安警察官の倉木は、警察の内部に巣くう闇を明らかにした。しかし、それは恐るべき陰謀の氷山の一角にすぎなかった。ある時、高層ビルが占拠・爆破され、ペナム共和国の大使館が襲撃されるという2つの大規模テロ事件が同時発生。暗殺専門の殺し屋・権藤を中心とするテログループの犯行だったが、権藤らの裏には日本の犯罪史に残る重大事件を裏で操ってきた「ダルマ」と呼ばれる存在があった。","2015年11月7日","2017-02-20 09:50:44","2017-02-20 09:50:44"
232,"サクラ花　桜花最期の特攻","http://image.eiga.k-img.com/images/movie/83228/poster2/200.jpg?1444987430","松村克弥","第2次世界大戦末期に生み出された、プロペラも燃料も積まず敵艦に突撃するだけの小型特攻機「桜花（おうか）」を題材にした戦争ドラマ。桜花特攻隊から奇跡的に生還した男性の証言や、戦時中につづられた手紙、生還者の手記などをもとに、これまであまり語られることのなかった真実をリアルに描き出す。終戦直前の昭和20年6月22日、茨城県の神之池基地から激戦地・沖縄へ向け、小型特攻機・桜花を搭載した大型爆撃機が飛び立つ。新人兵士の尾崎ら8人の乗員たちは、敵機からの猛攻で1人また1人と命を落としながらも、機長・穂積の機転や団結力でどうにか沖縄へとたどり着く。そして17歳の少年・沖田が桜花での出撃を命じられるが……。「ペコロスの母に会いに行く」の大和田健介が主人公・尾崎を演じ、緒形直人、渡辺裕之、林家三平らが脇を固める。役所広司がナレーションを担当。監督は「天心」の松村克弥。","2015年11月4日","2017-02-20 09:50:44","2017-02-20 09:50:44"
233,"氷の花火　山口小夜子","http://image.eiga.k-img.com/images/movie/82293/poster2/200.jpg?1441961932","松本貴子","1970年代からファッションモデルとして世界的に活躍し、「日本人の美しさ」を世界に広めた山口小夜子のドキュメンタリー。2007年に57歳で急逝するまで、モデルだけでなく、映画、演劇、ダンスパフォーマンス、衣装デザインなど、さまざまなジャンルで常に時代の先端を走り続けた山口の今なお多くの謎に包まれた人生を、彼女と親交のあった人たちの証言、本人の貴重な映像群により紐解いていく。監督は、生前の山口とも交友があり、「≒草間彌生　わたし大好き」などのドキュメンタリー作品を手がけている松本貴子。","2015年10月31日","2017-02-20 09:50:44","2017-02-20 09:50:44"
234,"アクトレス　女たちの舞台","http://image.eiga.k-img.com/images/movie/81620/poster2/200.jpg?1435284937","オリビエ・アサイヤス","華やかな芸能界で生きる大女優の孤独と葛藤を、ジュリエット・ビノシュ、クリステン・スチュワート、クロエ・グレース・モレッツら豪華女優陣の競演で描いたドラマ。有能なマネージャーのバレンティーヌと二人三脚で日々の仕事をこなすベテラン女優マリアは、自分が女優として成功するきっかけとなった作品のリメイクへの出演依頼を受ける。しかし、マリアに与えられたのはかつて自分が演じた若き美女シグリッド役ではなく、彼女の中年の上司ヘレナ役だった。やがてマリアは、ハリウッドで活躍する若手女優ジョアンがシグリッド役に配役されていることを知る。「夏時間の庭」のフランス人監督オリビエ・アサイヤスが監督・脚本を手がけ、女優たちの光と影を美しい映像と壮大なクラシック音楽にのせて映し出す。スチュワートがアメリカ人女優として初めてセザール賞助演女優賞を受賞して話題を集めた。シャネルの特別協力による洗練されたファッションにも注目。","2015年10月24日","2017-02-20 09:50:45","2017-02-20 09:50:45"
235,"愛と哀しみのボレロ","http://image.eiga.k-img.com/images/movie/41767/poster2/200.jpg?1440557577","クロード・ルルーシュ","フランスのクロード・ルルーシュ監督が1981年に手がけ、ルドルフ・ヌレエフ（バレエダンサー）、エディット・ピアフ（歌手）、ヘルベルト・フォン・カラヤン（指揮者）、グレン・ミラー（音楽家）という実在の4人の芸術家をモデルに、運命の糸に結ばれた人々の物語を描いた3時間を超える大作メロドラマ。ベルリン、モスクワ、パリ、ニューヨークを舞台に、第2次世界大戦前から戦中、そして現在へと至る中で、芸術家たちのドラマチックな人生模様が描き出される。「シェルブールの雨傘」「ロシュフォールの恋人たち」などで知られるミシェル・ルグランと「ある愛の詩」のフランシス・レイという映画音楽の巨匠2人が音楽を担当。さらに、モーリス・ラベル作曲、モーリス・ベジャール振付によるバレエの名作「ボレロ」を天才バレエダンサー、ジョルジュ・ドンが舞う。2015年、デジタルリマスター版でリバイバル公開。","2015年10月17日","2017-02-20 09:50:45","2017-02-20 09:50:45"
236,"ベトナムの風に吹かれて","http://image.eiga.k-img.com/images/movie/81541/poster2/200.jpg?1436408098","大森一樹","ベトナムで日本語教師として働く日本人女性・小松みゆき氏が認知症の母との暮らしをつづった「越後のBaちゃんベトナムへ行く」を、フィクションを交えながら松坂慶子主演で映画化した人間ドラマ。日本で離婚した後に憧れの地ベトナムへ移住し、日本語教師として働いているみさおは、認知症が進行しはじめた母を義兄が施設に預けようとしていることを知り、母をベトナムに連れて来ることを決意する。母は慣れない土地での生活に戸惑いながらも、ベトナムの人々の温かさに触れるうちに少しずつ笑顔を取り戻していく。そんなある日、母が思わぬケガを負ったことをきっかけに、みさおは介護の現実に直面する。母役に「Shall We ダンス？」の草村礼子。「ヒポクラテスたち」の大森一樹が監督を務めた。","2015年10月17日","2017-02-20 09:50:46","2017-02-20 09:50:46"
237,"先生と迷い猫","http://image.eiga.k-img.com/images/movie/81270/poster2/200.jpg?1428287083","深川栄洋","埼玉県の岩槻で実際にあった地域猫捜索の模様を記したノンフィクション「迷子のミーちゃん　地域猫と商店街再生の物語」（木附千晶著）を原案に、オリジナルキャラクターやストーリーを加えて映画化。「太陽」以来9年ぶりに映画主演を務めるイッセー尾形が、主人公となる頑固な元校長先生に扮した。校長職を定年退職し、妻に先立たれて一人暮らしをする森衣恭一。堅物で偏屈なことから近所でも浮いた存在で、訪ねてくるのは亡き妻がかわいがっていた野良猫のミイだけ。追い払おうとする森衣をよそに、ミイは毎日妻の仏壇の前に座っていた。そんなある日、ミイが姿を見せなくなり、気になって探し始めた始めた森衣は、同じようにミイを探す人々がいることを知り、その交流のなかで「いなくなってからでは伝えられない気持ち」に気付く。、「60歳のラブレター」「神様のカルテ」の深川栄洋監督がメガホンをとり、染谷将太、北乃きい、岸本加世子らが共演。","2015年10月10日","2017-02-20 09:50:46","2017-02-20 09:50:46"
