id,"title","image_url","director","detail","open_date","created_at","updated_at"
132,"風の波紋","http://image.eiga.k-img.com/images/movie/83280/poster2/200.jpg?1454038247","小林茂","新潟県の豪雪地帯・越後妻有の里山に移住した木暮夫妻の日常をとらえたドキュメンタリー。15年前に東京から中立山集落に移住してきた木暮夫妻は、茅葺屋根の古民家を自らの手で修繕し、見よう見まねで米を作って暮らしてきた。「阿賀に生きる」「阿賀の記憶」の撮影を担当した小林茂が監督を務め、5年の歳月をかけて取材を敢行。ときに厳しい自然に悩まされながらも、個性豊かな仲間たちと助け合いながら生きる彼らの暮らしを丹念に描き出す。","2016年3月19日","2017-02-20 09:44:48","2017-02-20 09:44:48"
133,"最高の花婿","http://image.eiga.k-img.com/images/movie/82204/poster2/200.jpg?1449201209","フィリップ・ドゥ・ショーブロン","多様な人種や宗教が混在するフランス社会を背景に、敬虔なカトリック教徒の夫妻が、娘の結婚相手をめぐって繰り広げるドタバタを描いたコメディドラマ。フランスで1200万人を動員する大ヒットを記録した。ロワール地方の町シノンに暮らすヴェルヌイユ夫妻は信心深いカトリック教徒で、3人の娘がそれぞれユダヤ人、アラブ人、中国人と結婚。これから結婚する末娘には、せめてカトリック教徒と結婚してほしいと願っていた。そんな末娘のボーイフレンドは、カトリック教徒だと聞いて安心していた夫妻だったが……。2015年のフランス映画祭では、「ヴェルヌイユ家の結婚狂騒曲」のタイトルで上映された。","2016年3月19日","2017-02-20 09:44:48","2017-02-20 09:44:48"
134,"父を探して","http://image.eiga.k-img.com/images/movie/83516/poster2/200.jpg?1455527128","アレ・アブレウ","ブラジルのインディペンデントアニメ界の新鋭アレ・アブレウ監督による長編アニメーション作品。全編セリフなしで描かれ、普遍的な寓話でありながら、ブラジルの現実も切り取った作風で、2014年のアヌシー国際アニメーション映画祭で最高賞にあたるクリスタルと観客賞をダブル受賞した。ある日、少年の父親は出稼ぎのためにどこかに旅立ってしまった。父親を見つけて、家に連れて帰ることを決意し、旅に出た少年を待ち受けていたのは、虐げられる農民たちの農村や、孤独が巣食う都会と、少年にとっては未知の広大な世界だった。少年は、行く先々で出会った大人たちや犬、音楽を奏でる楽隊の助けを得て父親を探していく。","2016年3月19日","2017-02-20 09:44:48","2017-02-20 09:44:48"
135,"つむぐもの","http://image.eiga.k-img.com/images/movie/82443/poster2/200.jpg?1448331028","犬童一利","和紙をはじめとする伝統産業が盛んな福井県丹南地域と、百済時代の面影を残す韓国・扶余（プヨ）を舞台に、頑固な職人と韓国から来た若い娘が次第に心を通わせていく人間ドラマ。妻を亡くして以来、偏屈な性格から誰とも心を通わせることなく生きる、越前和紙職人の剛生。脳腫瘍で倒れ、半身まひで介護が必要な体となってしまった剛生のもとにヘルパーとしてやって来たのが、韓国からワーキングホリデーで福井に訪れたフリーターのヨナだった。頑固な剛生と勝ち気なヨナ、文化も異なる2人は当然のように衝突するが、ヨナの常識にとらわれない介護により、固く閉ざされた剛生の心が次第に開いていく。主人公・剛生役に、役者人生50年にして本作が映画初主演となる石倉三郎。ヨナ役には「息もできない」のキム・コッピ。監督は「カミングアウト」「早乙女4姉妹」などを手がけた犬童一利。","2016年3月19日","2017-02-20 09:44:48","2017-02-20 09:44:48"
136,"天使に“アイム・ファイン”","http://image.eiga.k-img.com/images/movie/84196/poster2/200.jpg?1453970421","園田映人","大川隆法が製作総指揮と原作を手がけ、それぞれ悩みを抱える5人の人間と彼らに救いの手を差し伸べる天使の姿を描いたドラマ。同級生からのいじめに苦しむ小学5年生の風香、父の八百屋が原発事故の影響で経営難に陥り大学進学の道を絶たれた優也、末期がんを宣告された大女優・吉乃、国政選挙に落選し志を失いかけた護、姉を亡くし目的を見失った女優の卵・美里。悩める彼らを救うため、1人の天使が地上に舞い降りる。天使の愛を受け、5人の人生は少しずつ変わりはじめる。「ウルトラマンギンガ」の雲母が天使役と美里役を1人2役で演じ、「1リットルの涙」の芦川よしみ、「海難1890」の金子昇らが共演。監督は「尖閣ロック」の園田映人。","2016年3月19日","2017-02-20 09:44:49","2017-02-20 09:44:49"
137,"僕だけがいない街","http://image.eiga.k-img.com/images/movie/82570/poster2/200.jpg?1452826053","平川雄一朗","三部けい原作の大ヒットコミックを藤原竜也＆有村架純共演で実写映画化し、タイムリープによって18年前の児童連続誘拐事件の謎に迫る青年の奮闘を描いたSFミステリー。ピザ屋でアルバイトする売れない漫画家・悟は、ある日突然「リバイバル」という特殊な現象に見舞われるように。それは、周囲で悪いことが起きる気配を察すると自動的にその数分前に戻り、事件や事故の原因を取り除くまで何度でも繰り返すというものだった。リバイバルによって大事故を防いだものの自らが大怪我を負った悟は、同僚の愛梨や上京してきた母の看病で回復していく。そんなある日、悟の母が何者かに殺害されリバイバルが起きるが、今回はなぜか数分前ではなく18年前だった。そこは、悟の同級生が被害者となった連続誘拐殺人事件が起きる直前の世界だった。監督は「ツナグ」「ROOKIES 卒業」の平川雄一朗。","2016年3月19日","2017-02-20 09:44:50","2017-02-20 09:44:50"
138,"リリーのすべて","http://image.eiga.k-img.com/images/movie/82988/poster2/200.jpg?1447906136","トム・フーパー","「英国王のスピーチ」でアカデミー賞を受賞したトム・フーパー監督と、「博士と彼女のセオリー」でアカデミー賞の主演男優賞を手にしたエディ・レッドメインが、「レ・ミゼラブル」に続いてタッグを組み、世界で初めて性別適合手術を受けたリリー・エルベの実話を描いた伝記ドラマ。1926年、デンマーク。風景画家のアイナー・ベルナーは、肖像画家の妻ゲルダに頼まれて女性モデルの代役を務めたことをきっかけに、自身の内側に潜む女性の存在を意識する。それ以来「リリー」という名の女性として過ごす時間が増えていくアイナーは、心と身体が一致しない現実に葛藤する。ゲルダも当初はそんな夫の様子に戸惑うが、次第にリリーに対する理解を深めていく。第88回アカデミー賞で主演男優賞、助演女優賞など4部門でノミネートを受け、ゲルダを演じたアリシア・ビカンダーが助演女優賞を受賞した。","2016年3月18日","2017-02-20 09:44:50","2017-02-20 09:44:50"
139,"Mr.ホームズ　名探偵最後の事件","http://image.eiga.k-img.com/images/movie/81863/poster2/200.jpg?1450923648","ビル・コンドン","「ロード・オブ・ザ・リング」「X-MEN」シリーズのイアン・マッケランが、引退した老齢の名探偵シャーロック・ホームズに扮し、自身を引退に追い込んだ未解決事件と再び対峙する様を描いたミステリー作品。ある男性から不可解な行動を取る妻の素行調査を依頼されたホームズだったが、その謎解きはホームズの人生最大の失態となり、探偵稼業を引退することとなった。あれから30年、93歳となったホームズは、30年前の未解決事件に決着をつけるため、ロジャー少年を助手に迎え、最後の推理を始める。現役から退き、93歳となった年老いたホームズをマッケランが演じ、アカデミー賞ノミネート女優ローラ・リニー、真田広之らが脇を固める。監督は「ドリームガールズ」などを手がけたビル・コンドン。","2016年3月18日","2017-02-20 09:44:50","2017-02-20 09:44:50"
140,"アーロと少年","http://image.eiga.k-img.com/images/movie/77788/poster2/200.jpg?1446624063","ピーター・ソーン","巨大隕石の墜落による恐竜絶滅が起こらなかったらという仮説に基づき、恐竜が地上で唯一言葉を話す種族として存在している世界を舞台に、弱虫の恐竜アーロが、孤独な人間の少年スポットとの冒険を通して成長していく姿を描いたピクサー・アニメーション。兄や姉に比べて体も小さく、甘えん坊の末っ子アーロは、何をするにも父親がいてくれないと始まらない。そんなある日、アーロは川に落ちて激流に飲み込まれ、家族から遠く離れた見知らぬ土地へと流されてしまう。ひとりぼっちの寂しさと不安にさいなまれるアーロは、そこで自分と同じ孤独な少年スポットと出会い、一緒にアーロの故郷を目指す冒険に出る。","2016年3月12日","2017-02-20 09:44:51","2017-02-20 09:44:51"
141,"エスコバル　楽園の掟","http://image.eiga.k-img.com/images/movie/83902/poster2/200.jpg?1456454874","アンドレア・ディ・ステファノ","ベニチオ・デル・トロが実在した麻薬王パブロ・エスコバルに扮し、エスコバルの光と闇を描く犯罪ドラマ。コロンビアを訪れたカナダ人青年ニックがコロンビア人女性のマリアと恋に落ちた。マリアが敬愛する叔父のパブロ・エスコバルは、国会議員として慈善事業に携わり、多くの人からの支持を集める一方で、コロンビア最大の麻薬カルテルのボスというもう一つの顔があった。マリアが連れてきた恋人のニックをエスコバルはあたたかくファミリーへと迎え入れる。それはニックにとって後戻りすることができない裏の世界の入り口を意味していた。エスコバル役のデル・トロのほか、ニック役を「ハンガー・ゲーム」シリーズのジョシュ・ハッチャーソンが共演。監督は「夜になるまえに」などで俳優として活躍し、本作品が初の監督作品となるアンドレア・ディ・ステファノ。","2016年3月12日","2017-02-20 09:45:42","2017-02-20 09:45:42"
142,"エヴェレスト　神々の山嶺（いただき）","http://image.eiga.k-img.com/images/movie/80572/poster2/200.jpg?1443058808","平山秀幸","第11回柴田錬三郎賞を受賞した夢枕獏による小説「神々の山嶺」を、「愛を乞うひと」などを手がけた平山秀幸監督のメガホンにより映画化。「永遠の0」の岡田准一、「テルマエ・ロマエ」の阿部寛、「そして父になる」の尾野真千子といういずれも実力派のキャストが初共演を果たす。ヒマラヤ山脈を望むネパールの首都カトマンズで、山岳カメラマンの深町誠が発見した1台の古いカメラ。そのカメラは、イギリスの登山家ジョージ・マロリーが、1942年6月8日にエベレスト初登頂に成功したのか否かという、登山史上最大の謎を解く可能性を秘めたものだった。カメラの過去を追う深町は、その過程で、かつて天才クライマーと呼ばれながらも、無謀で他人を顧みないやり方のために孤立した伝説のアルピニスト・羽生丈二と出会う。深町は羽生の過去を調べるうちに、羽生という男の生きざまにいつしか飲み込まれていく。","2016年3月12日","2017-02-20 09:45:43","2017-02-20 09:45:43"
143,"家族はつらいよ","http://image.eiga.k-img.com/images/movie/81075/poster2/200.jpg?1448853238","山田洋次","名匠・山田洋次監督が「男はつらいよ」シリーズ終了から約20年ぶりに手がけた喜劇。山田監督の「東京家族」で一家を演じた橋爪功、吉行和子、妻夫木聡、蒼井優ら8人のキャストが再結集して現代に生きる新たな一家に扮し、熟年夫婦の離婚騒動をめぐって織り成される人間模様を描く。結婚50年を目前に控えた平田夫妻。夫はもうすぐ誕生日を迎える妻にプレゼントを贈ろうと欲しいものを尋ねるが、その答えはなんと「離婚届」だった。突如として持ち上がった離婚話に、彼らの子どもたちは大慌て。すぐに家族会議が開かれることになるが、それぞれが抱えてきた不満が噴出してしまう。","2016年3月12日","2017-02-20 09:45:43","2017-02-20 09:45:43"
144,"劇場版　ウルトラマンX きたぞ！われらのウルトラマン","http://image.eiga.k-img.com/images/movie/83703/poster2/200.jpg?1449816544","田口清隆","円谷プロダクションによる特撮テレビドラマ「ウルトラマンX」の劇場版。ウルトラマンエックスのほか、テレビシリーズで共闘したネクサス、マックス、ゼロらウルトラ戦士が結集。ウルトラマンとウルトラマンティガも参戦する。太古の昔に地獄が封じ込められたと伝えられる芭羅慈（バラジ）遺跡の封印が破られ、この世を地獄に変える閻魔獣ザイゴーグが復活。ウルトラマンエックスは、その恐るべき力の前に絶体絶命の危機に陥る。一方、地球防衛の特捜チーム「Xio（ジオ）」の隊員たちは、考古学者・玉城ツカサと協力しながら、ザイゴーグ封印の鍵となる神秘の石を追跡。ツカサの息子ユウトの母への思いが奇跡を呼び、ウルトラマンとウルトラマンティガが駆け付ける。","2016年3月12日","2017-02-20 09:45:44","2017-02-20 09:45:44"
145,"人生は小説よりも奇なり","http://image.eiga.k-img.com/images/movie/83596/poster2/200.jpg?1455872072","アイラ・サックス","念願の同性婚を果たしたカップルの悲喜こもごもを描いたドラマ。ニューヨーク、マンハッタンに暮らす画家のベンと音楽教師のジョージは、39年間連れ添ってきた同性カップル。2011年、ニューヨーク州で同性婚が可能になったことで、念願かなって入籍した2人だったが、まだまだ周囲の差別や偏見は根強く、ジョージは仕事をクビになってしまう。その後も保険や年金、不動産などで次々と問題が押し寄せ、2人は新婚早々、長年暮らしていたアパートを離れ、別居しなければならなくなってしまい……。主人公ベン役は「愛と追憶の日々」「インターステラー」のジョン・リスゴー、ジョージ役は「スパイダーマン2」のアルフレッド・モリーナ。監督・脚本は「あぁ、結婚生活」のアイラ・サックス。","2016年3月12日","2017-02-20 09:45:44","2017-02-20 09:45:44"
146,"母よ、","http://image.eiga.k-img.com/images/movie/83742/poster2/200.jpg?1451269260","ナンニ・モレッティ","「息子の部屋」のナンニ・モレッティ監督による自叙伝的作品で、母親の介護など、プライベートの難題を抱えながら、映画製作に取り組む女性映画監督を主人公に描いたドラマ。恋人とも別れ、娘の進路問題も抱え、兄とともに入院中の母親の世話をしている映画監督のマルゲリータ。撮影中の新作映画は、アメリカ人俳優バリー・バギンズが撮影に参加した途端、思うように撮影が進まなくなる。ストレスが募る中、追い討ちをかけるかのように、病院から母親の余命宣告を受けてしまう。主人公のマルゲリータ役を演じるのは「はじまりは5つ星ホテルから」などで知られ、モレッティ監督作品でも常連のマルゲリータ・ブイ。アメリカ俳優バリー・バギンズ役には「エクソダス：神と王」「ジゴロ・イン・ニューヨーク」のジョン・タトゥーロ。マルゲリータの兄役でモレッティ自身も出演。","2016年3月12日","2017-02-20 09:45:44","2017-02-20 09:45:44"
147,"ヒロシマ、そしてフクシマ","http://image.eiga.k-img.com/images/movie/84197/poster2/200.jpg?1456724858","マーク・プティジャン","広島に原爆が投下された1945年8月6日以来、被爆者の治療や反核活動を続けてきた96歳の肥田舜太郎医師の闘いを追ったドキュメンタリー。戦後65年にわたって広島や長崎の被爆者を診療するうちに内部被曝の恐ろしさを知り、その危険性を世界に向けて訴え続けてきた肥田医師。「核の傷　肥田舜太郎医師と内部被曝」のフランス人監督マーク・プティジャンが再び肥田医師に密着し、福島原発事故の被災者たちが暮らす町での活動や、沖縄での講演会の模様を取材。平和で核のない日本の未来を願う肥田医師が、歴史から何も学ぼうとしない体制に向けて警鐘を鳴らす姿を映し出す。","2016年3月12日","2017-02-20 09:45:44","2017-02-20 09:45:44"
148,"プリパラ　み～んなのあこがれ♪レッツゴー☆プリパリ","http://image.eiga.k-img.com/images/movie/83402/poster2/200.jpg?1453341191","森脇真琴","誰もがアイドルになれるテーマパーク「プリパラ」を舞台に、主人公の少女らぁらが、「神アイドル」を目指して奮闘する姿を描いた人気アニの劇場版。「プリパラ」シリーズでは初のオリジナルストーリーでの映画化となる。ある日、らぁらのもとに、プリパラにいる大切な友だちのファルルからメッセージが届く。それによれば、プリパラからキラキラが失われており、このままではプリパラが消滅してしまうという。プリパラを守るため、アイドルたちはチームに分かれ、世界中のプリパラステージで「いいね」を集めていく。ストーリーが3つに分岐し、劇場公開から1週間ごとに異なるストーリーが上映される。","2016年3月12日","2017-02-20 09:45:45","2017-02-20 09:45:45"
149,"ボクのスーパーチーム","http://image.eiga.k-img.com/images/movie/84463/200x133.jpg?1458095749","サンジェイ・パテル","ピクサー・アニメーションの短編作品で、長編「アーロと少年」と同時上映。第88回アカデミー賞短編アニメーション部門ノミネート。インド系移民の父親のもと、南カリフォルニアで育ったサンジェイ・パテル監督が、自身の幼い頃の思い出をもとに手がけた。大好きなヒーロー番組を見たいのに、父親にテレビを消してお祈りをするようにと言われてしまったサンジェイ。仕方なくお祈りをしていると、目の前にヒンドゥー教の神様が現れて……。","2016年3月12日","2017-02-20 09:45:45","2017-02-20 09:45:45"
150,"マジカル・ガール","http://image.eiga.k-img.com/images/movie/83438/poster2/200.jpg?1452649595","カルロス・ベルムト","日本の魔法少女アニメにあこがれる少女とその家族がたどる、思いがけない運命を描いたスペイン映画。独創的なストーリーや全編を貫くブラックユーモアが話題を集め、スペインのサン・セバスチャン国際映画祭でグランプリと観客賞を受賞するなど、高い評価を獲得した。監督はこれが長編映画デビュー作となる新鋭カルロス・ベルムト。白血病で余命わずかな少女アリシアは、日本のアニメ「魔法少女ユキコ」の大ファン。ユキコのコスチュームを着て踊りたいというアリシアの夢をかなえるため、失業中の父ルイスは高額なコスチュームを手に入れようと決意する。しかし、そんなルイスの行動が、心に闇を抱えた女性バルバラやワケありな元教師ダミアンらを巻き込み、事態は思わぬ方向へと転じていく。","2016年3月12日","2017-02-20 09:45:46","2017-02-20 09:45:46"
151,"インサイダーズ　内部者たち","http://image.eiga.k-img.com/images/movie/83733/poster2/200.jpg?1453453136","ウ・ミンホ","イ・ビョンホン主演で、財閥と政治家の癒着によって腐敗した巨大権力をめぐり3人の男たちが騙しあいを仕掛けあう様を描いたサスペンスアクション。策士であるガンヒに雇われ、裏で悪事を代行するアン・サングは、財閥企業であるミライ自動車が大統領候補へ裏金を送っていた証拠を手に入れ、ミライ自動車をゆすることを企てる。裏金ファイルがアン・サングの手に渡ったことで、裏金事件の捜査が打ち切りとなってしまった検事ウ・ジャンフンは、一切の責任を取らされて左遷となってしまう。諦めきれないウ・ジャンフンは、ミライ自動車の一件が失敗し、失墜したアン・サングに接触。一発逆転の秘策を持ちかけるが……。アン・サング役をイ・ビョンホン、検事ウ・ジャンフン役をチョ・スンウ、策士ガンヒ役をペク・ユンシクがそれぞれ演じる。","2016年3月11日","2017-02-20 09:45:46","2017-02-20 09:45:46"
152,"しまじろうと えほんのくに","http://image.eiga.k-img.com/images/movie/83446/poster2/200.jpg?1455683361","","ベネッセコーポレーションの幼児向け通信教育教材「こどもちゃれんじ」の人気キャラクター、しまじろうと仲間たちが繰り広げる冒険を描く劇場版第4弾。ある日、しまじろうたちは1冊の不思議な絵本を海辺で発見する。それは、しまじろうがまだ小さいときに大切にしていたものだった。すると、どこからかしまじろうたちを呼ぶ声が聞こえてきて、彼らは絵本の中に吸い込まれてしまう。しまじろうたちはそこで出会った可愛らしい生き物「プニたん」と一緒に、絵本の国を救う旅に出る。映画館が初めての小さな子どもでも安心して楽しめるよう、登場人物たちと一緒に歌ったり踊ったりして参加できるような工夫や、劇場内を完全に暗くしない、途中休憩をはさむなどの配慮もなされている。","2016年3月11日","2017-02-20 09:45:47","2017-02-20 09:45:47"
153,"RADWIMPSのHESONOO Documentary Film","http://image.eiga.k-img.com/images/movie/83894/poster2/200.jpg?1453453468","朝倉加葉子","2015年にメジャーデビュー10周年を迎えた人気ロックバンド「RADWIMPS」の活動を追ったドキュメンタリー。韓国、台湾、ドイツ、イギリス、フランスで計6公演を開催したアジア・ヨーロッパツアーをはじめ、「Mr.Children」「いきものがかり」「ゲスの極み乙女。」といった豪華アーティストを招いて敢行した「胎盤（対バン）ツアー」、10周年の集大成となった幕張メッセでのワンマンライブに密着。圧倒的なライブパフォーマンスはもちろん、ツアーの舞台裏やメンバーのインタビューなどを通し、その魅力をあますところなく捉えた。監督は、「クソすばらしいこの世界」などを手がけた新鋭女性監督の朝倉加葉子。","2016年3月11日","2017-02-20 09:45:47","2017-02-20 09:45:47"
