id,"title","image_url","director","detail","open_date","created_at","updated_at"
1,"オオカミ少女と黒王子","http://image.eiga.k-img.com/images/movie/82939/poster2/200.jpg?1456105504","廣木隆一","八田鮎子の同名人気コミックを二階堂ふみ、山崎賢人の主演で実写映画化。恋愛経験ゼロにもかかわらず、見栄っ張りで友達と架空の彼氏との恋愛話を語る「オオカミ少女」の篠原エリカ。街で見かけたイケメンの盗撮写真を自分の彼氏だと偽り、友達をやりすごそうとするが、写真の男は女子から絶大な人気を集めている同級生・佐田恭也だった。エリカは事情を打ち明け、恭也に彼氏のフリをすることを承諾してもらうが、その代わりにエリカが飲んだ条件は恭也の「犬」となること。人当たりがよく人気者の恭也の本性は、評判とは真逆の、腹黒で超がつくドSの「黒王子」だったのだ。かくして、偽装カップルとなったエリカと恭也だったが……。監督は「ストロボ・エッジ」「娚の一生」など少女コミックの映画化を数多く手がけている廣木隆一。","2016年5月28日","2017-02-20 08:56:18","2017-02-20 08:56:18"
2,"ヒメアノ～ル","http://image.eiga.k-img.com/images/movie/82031/200x133.jpg?1458617968","吉田恵輔","「行け！稲中卓球部」「ヒミズ」の古谷実による同名コミックを、「V6」の森田剛主演で実写映画化。森田が、次々と殺人を重ねていく主人公の快楽殺人犯・森田正一役を演じ、「純喫茶磯辺」「銀の匙 Silver Spoon」などを手がけた吉田恵輔監督がメガホンをとった。平凡な毎日に焦りを感じながら、ビルの清掃のパートタイマーとして働いている岡田は、同僚の安藤から思いを寄せるカフェの店員ユカとの恋のキューピッド役を頼まれる。ユカが働くカフェで、高校時代に過酷ないじめに遭っていた同級生の森田正一と再会する岡田だったが、ユカから彼女が森田にストーキングをされている事実を知らされる。岡田役を濱田岳、ユカ役を佐津川愛美、安藤役をムロツヨシがそれぞれ演じる。","2016年5月28日","2017-02-20 08:56:18","2017-02-20 08:56:18"
3,"エンド・オブ・キングダム","http://image.eiga.k-img.com/images/movie/84396/poster2/200.jpg?1456105395","ババク・ナジャフィ","米大統領専属シークレットサービスとテロリストとの激しい攻防を、ジェラルド・バトラー主演で描いたアクションサスペンス「エンド・オブ・ホワイトハウス」の続編。物語の舞台を前作の米ホワイトハウスから、イギリスの首都ロンドンへと移し、テロリズムとの新たな戦いが描かれる。ホワイトハウス陥落の悪夢から2年。イギリスの首相が不可解な死を遂げ、ロンドンで行われる葬儀に各国首脳が出席することに。しかし、史上まれにみる厳戒態勢の中でも各国首脳を狙った同時多発テロが起こってしまう。米大統領と身辺を警護するシークレットサービスは、命からがらに危機から脱するのだが……。","2016年5月28日","2017-02-20 08:56:19","2017-02-20 08:56:19"
4,"素敵なサプライズ　ブリュッセルの奇妙な代理店","http://image.eiga.k-img.com/images/movie/83818/poster2/200.jpg?1452581497","マイケ・ファン・ディム","「キャラクター　孤独な人の肖像」で第70回アカデミー外国語映画賞を受賞したマイケ・ファン・ディムが監督と脚本を務め、オランダの大富豪が自殺ほう助を裏稼業とする謎の代理店を訪れたことから巻き起こる騒動を描いたコメディ作品。何不自由ない日々を送る大富豪のひとり息子ヤーコブは、楽しみのない人生に嫌気がさし、自殺を試みるが、常に邪魔が入り自殺できずにいた。たまたま拾ったマッチ箱に記された謎の「代理店」をベルギーまで訪ねると、その店は事故に見せかけて自殺をほう助するサービスを提供する旅行代理店だった。主人公のヤーコブ役を演じるのは「LOFT 完全なる嘘（トリック）」などに出演しているコメディ俳優イェルーン・ファン・コーニングスブリュッヘ。","2016年5月28日","2017-02-20 08:56:19","2017-02-20 08:56:19"
5,"手をつないでかえろうよ　シャングリラの向こうで","http://image.eiga.k-img.com/images/movie/83316/photo/704e52e243018fe7/320.jpg?1460515565","奈良橋陽子","2015年5月に他界した俳優・今井雅之が原作・脚本・演出・主演を務めた舞台を映画化。同じく今井による舞台を映画化した「WINDS OF GOD」の奈良橋陽子監督が、今井自らが手がけた脚本をもとにメガホンをとる。軽度の知的障害を持つ真人は、中学校で特殊学級に入り差別やいじめに遭いながらも、同じ障害を抱える咲楽と惹かれあっていく。やがて2人は結婚するが、真人は咲楽を守るために罪を犯してしまう。咲楽と行くはずだった新婚旅行を思い描くように1人旅に出た真人は、車で伊勢神宮を目指す途中で、ヒッチハイクしていた女性・麗子と出会う。主人公・真人役に川平慈英。","2016年5月28日","2017-02-20 08:56:20","2017-02-20 08:56:20"
6,"復活","http://image.eiga.k-img.com/images/movie/84404/photo/b1ea2006aea01769/320.jpg?1462845161","ケビン・レイノルズ","イエス・キリスト復活のエピソードを、「ウォーターワールド」「ロビン・フッド」のケビン・レイノルズ監督が映画化した歴史ドラマ。古代ローマ。処刑されたはずのイエス・キリストの遺体が消失した。メシア復活の噂と反乱の気運が高まりつつあることを危惧したローマ総督ピラトは、処刑を執行した百人隊長クラビアスに調査を命じる。クラビアスはイエスの弟子たちが遺体を隠したと考え、弟子たちの隠れ家に踏み込むが、そこで思いがけない人物に遭遇する。クラビアス役に「恋におちたシェイクスピア」のジョセフ・ファインズ。共演に「ハリー・ポッター」シリーズのトム・フェルトン。","2016年5月28日","2017-02-20 08:56:20","2017-02-20 08:56:20"
7,"あのひと","http://image.eiga.k-img.com/images/movie/82788/photo/e8e36657b9a98933/320.jpg?1460950312","山本一郎","「夫婦善哉」で知られる無頼派の作家・織田作之助が、太平洋戦争末期の昭和19年（1944年）に書いたとされ、2012年に大阪の中之島図書館で発見された映画脚本を映画化。「珈琲時光」「武士の一分」でなどプロデューサーを務めてきた山本一郎が初監督を務め、残された脚本を一字一句変えずに、独自の解釈でモノクロ＆スタンダードで映像化した。戦死した部隊長の遺児を育てる4人の帰還軍人たち。しかし、戦局の悪化とともに帰還軍人たちは軍需工場に働きに出ることになり、代わりに4人の女たちが遺児を預かることに。「小隊長」と呼ばれる遺児の少年を中心に、戦時下の奇妙な共同生活をユーモラスに描いた。","2016年5月28日","2017-02-20 08:56:20","2017-02-20 08:56:20"
8,"或る終焉","http://image.eiga.k-img.com/images/movie/83700/poster2/200.jpg?1456993166","マイケル・フランコ","「父の秘密」で高い評価を得たメキシコの新鋭マイケル・フランコが「海の上のピアニスト」のティム・ロスを主演に迎え、終末期の患者をケアする看護師の葛藤をサスペンスフルに描いたヒューマンドラマ。死期が迫った患者の看護師として働くデビッド。息子の死をきっかけに元妻や娘と疎遠になった彼は、患者の在宅看護とエクササイズに励むだけの寂しい日々を送っており、患者たちとの親密な関係が心の拠りどころとなっていた。そんなある日、デビッドは末期がん患者のマーサから、安楽死を手伝ってほしいと頼まれる。共演にキーファー・サザーランドの娘サラ・サザーランド。第68回カンヌ国際映画祭で脚本賞を受賞した。","2016年5月28日","2017-02-20 08:56:24","2017-02-20 08:56:24"
9,"CONFLICT 最大の抗争","http://image.eiga.k-img.com/images/movie/83914/photo/ef49227bafc3396f/320.jpg?1462161535","藤原健一","小沢仁志、哀川翔、白竜らVシネマや任侠映画界を支えてきたオールスターキャストで、ヤクザやマフィア、半グレ、政治家、警察を巻き込んだ一大抗争を描く。日本最大のヤクザ組織・天道会の傘下になる兵頭組の組長が殺害され、天道会若頭で鷲尾組組長の鷲尾一馬は、兵頭の殺しの背後に、元天道会若頭補佐で今は東京の半グレやアウトローを仕切る明神良成の存在を嗅ぎとる。そんな折、天道会5代目会長の勝重から、「東京カジノ計画」の利権争いの鍵を握る遠山凪という女性の身柄を押さえるよう命じられた鷲尾は、子分を連れて行動に出るが、そこで武装した若者たちに襲撃される。","2016年5月28日","2017-02-20 08:56:25","2017-02-20 08:56:25"
10,"燐寸少女　マッチショウジョ","http://image.eiga.k-img.com/images/movie/84204/photo/c71da94191642fcc/320.jpg?1461206311","内田浩","「SKE48」の佐藤すみれが映画単独初主演を飾り、「ヤングエース」連載の同名漫画を実写映画。心に闇を持った人々の前に、寿命と引き替えに人間の心に潜む妄想を具現化する「妄想燐寸（マッチ）」を持つ少女リンが現れる。恐る恐るマッチを擦った人々は、具現化する妄想にのめり込んでいく。しかし、欲望や嫉妬、嘘が渦巻く妄想を具現化した者たちは、思わぬ代償を払うことになる。謎の少女リンを佐藤が演じるほか、名古屋を中心に活動する人気グループ「BOYS AND MEN」の小林豊、本田剛文、アニメ「黒子のバスケ」の声優としても知られる小野賢章らが出演。","2016年5月28日","2017-02-20 08:56:26","2017-02-20 08:56:26"
11,"エルヴィス、我が心の歌","http://image.eiga.k-img.com/images/movie/84452/poster2/200.jpg?1456978768","アルマンド・ボー","アレハンドロ・ゴンサレス・イニャリトゥ監督の「BIUTIFUL ビューティフル」「バードマン　あるいは（無知がもたらす予期せぬ奇跡）」で共同脚本を務めたアルマンド・ボーの初長編監督作品。昼は金型工場で働き、夜はエルビス・プレスリーのトリビュートアーティストとしてステージに立つカルロス。自分がエルビスの生まれ変わりと信じて疑わないカルロスに妻と娘は愛想を尽かして家を出て行ってしまった。ある出来事から、別居中の娘の面倒を見ることになったカルロスは、次第に父親としての自覚が芽生えていくが、彼にはどうしても実現しなければならない大きな夢があった。それはエルビスファンの聖地であるテネシー州メンフィスの「グレイスランド」へ向かうことだった。主人公カルロス役にアルゼンチンでエルビスのトリビュートアーティストとして活躍するジョン・マキナニー。","2016年5月28日","2017-02-20 08:56:27","2017-02-20 08:56:27"
12,"女ヒエラルキー底辺少女","http://image.eiga.k-img.com/images/movie/84904/photo/242d864dadbc8856/320.jpg?1462879638","森岡利行","こじらせ系女子の主人公・桃子の高校生活を描いた鈴木詩子による同名コミックを実写映画化。「女の子ものがたり」「ハダカの美奈子」の森岡利行監督がメガホンをとり、元「AKB48」の1期生・平嶋夏海が主演を務めた。おバカキャラと冴えない見た目のせいで、校内ヒエラルキーの底辺にいる女子高生の桃子。友人たちはナンパされたり、彼氏とデートしたりとリア充な日々を送っているが、桃子は彼氏いない歴イコール年齢で、散々な学園生活を送っていた。自分を馬鹿にするクラスメイトをムチでいたぶる妄想をし、ストレスを発散する桃子だったが……。","2016年5月28日","2017-02-20 08:56:28","2017-02-20 08:56:28"
13,"リリカルスクールの未知との遭遇","http://image.eiga.k-img.com/images/movie/84165/photo/941cd4573c4e2310/320.jpg?1458876636","デモ田中","ヒップホップアイドルユニット「lyrical school（リリカルスクール）」の映画初主演作。レコード店のバイト仲間、ayaka、mei、yumi、ami、minan、himeは、アイドルラップグループ「リリカルスクール」を結成し、いつかスポットライトを浴びる日を夢見て地道に活動をしていた。ある日、たまり場である倉庫の片隅にあった人形「バムさん」が突然しゃべりだした。その人形は宇宙からやって来たのだが、エネルギーが足りずに自分の星に帰れないのだという。バムさんを星に帰すエネルギーを作るため、6人は大観衆を集めたパーティーを計画するが……。リリカルスクールが劇中でもリリカルスクールを演じるほか、スチャダラパーのANI、バッファロー吾郎Aなど、個性的な顔ぶれが脇を固める。監督は井口昇作品の常連で「進撃の巨人」などにも出演したデモ田中。本作が商業映画監督デビュー作となる。","2016年5月28日","2017-02-20 08:56:28","2017-02-20 08:56:28"
14,"若葉のころ","http://image.eiga.k-img.com/images/movie/84418/poster2/200.jpg?1456916251","ジョウ・グータイ","1971年公開の「小さな恋のメロディ」挿入曲としてヒットしたビージーズの「若葉のころ」のメロディとともに、母と娘それぞれの初恋を描いた台湾発のラブストーリー。母が17歳だった1982年と娘が17歳の2013年を舞台に、それぞれの初恋の揺れる思いを瑞々しく描いた。離婚した母や祖母と一緒に台北で暮らす女子高生バイは、親友ウエンと男友達イエの関係に心を痛めていた。そんなある日、母ワンが交通事故で意識不明の重体に陥ってしまう。偶然にも母のパソコンから初恋相手リン宛の未送信メールを発見したバイは、母の青春に思いを馳せる。監督はジョイ・チョウ、メイデイなど人気アーティストのミュージックビデオを手掛け、本作が長編初監督作品となるジョウ・グーダイ。韓国ドラマ「美男＜イケメン＞ですね」の台湾リメイク版で注目を集めたルゥルゥ・チェンが、若き日の母ワンと主人公バイの2役を演じ、ワンの初恋相手リン役をジョニー・トー監督作品などで知られるリッチー・レンが演じる。","2016年5月28日","2017-02-20 08:56:35","2017-02-20 08:56:35"
15,"スノーホワイト　氷の王国","http://image.eiga.k-img.com/images/movie/83708/photo/3306840c771af07d/320.jpg?1458877882","セドリック・ニコラス＝トロイヤン","グリム童話の「白雪姫」を大胆にアレンジして描いたアクションファンタジー「スノーホワイト」の続編。ハンターのエリックを主人公に、前作でスノーホワイトとエリックによって滅ぼされた邪悪な女王ラヴェンナの過去や、ラヴェンナの妹で「氷の女王」と呼ばれるフレイヤの存在を描く。かつてラヴェンナにはフレイヤという愛情深い妹がいたが、ある事件をきっかけに、フレイヤは大きな悲しみに襲われ、悲しみと引き換えに強大な魔力を手に入れた。姉のもとを離れたフレイヤは、北の大地で自分だけの氷の王国を築いていたが、そんな彼女のもとに、姉のラヴェンナがハンターのエリックの剣によって滅ぼされたとの報せが届く。姉の死を知ったフレイヤは、配下の軍団に「魔法の鏡」を奪ってくるよう命じる。エリック役のクリス・ヘムズワースやラヴェンナ役のシャーリーズ・セロンが前作から再登場。フレイヤ役で「オール・ユー・ニード・イズ・キル」のエミリー・ブラント、女戦士サラ役で「ゼロ・ダーク・サーティ」「オデッセイ」のジェシカ・チャステインが新たに出演。","2016年5月27日","2017-02-20 08:56:38","2017-02-20 08:56:38"
16,"神様メール","http://image.eiga.k-img.com/images/movie/83805/poster2/200.jpg?1458803848","ジャコ・バン・ドルマル","「トト・ザ・ヒーロー」「八日目」などで知られるベルギーの異才ジャコ・バン・ドルマル監督が、前作「ミスター・ノーバディ」以来6年ぶりに手がけた監督第4作で、ベルギー・ブリュッセルの街に暮らす神様と、その娘が引き起こす騒動を描いたファンタジックコメディ。ブリュッセルの街に家族と一緒に暮らしている神様は、自分の部屋のパソコンで世界を管理し、面白半分で事故や災害を引き起こしている。そんな父に憤慨した10歳の娘エアは、それまで一歩も出たことがなかった街に出ることを決意。しかし、家出の前に立ち入りを禁じられている父の部屋に忍び込んでパソコンを触った彼女は、間違えて世界中の人々に死期を知らせるメールを送信してしまう。エアは人間たちを救済しようと街に繰り出し、そんな娘を追って神様も街に出るが……。","2016年5月27日","2017-02-20 08:56:38","2017-02-20 08:56:38"
17,"マイケル・ムーアの世界侵略のススメ","http://image.eiga.k-img.com/images/movie/84410/poster2/200.jpg?1458179953","マイケル・ムーア","「ボウリング・フォー・コロンバイン」や「華氏911」など、アメリカ国内のさまざまな問題を独自の観点で切り込んできたマイケル・ムーアによる「世界侵略」をテーマにしたドキュメンタリー作品。度重なる侵略戦争が良い結果にならなかったというアメリカ国防総省幹部からの切実な悩みを持ちかけられたムーア。そこでムーアは、自身が国防省に代わり、「侵略者」となって、世界各国から「あるモノ」を略奪するために出撃することを提案。ムーアは空母ロナルド・レーガンに搭乗し、ヨーロッパを目指すが……。","2016年5月27日","2017-02-20 08:56:40","2017-02-20 08:56:40"
18,"海よりもまだ深く","http://image.eiga.k-img.com/images/movie/83901/poster2/200.jpg?1458007228","是枝裕和","「海街diary」「そして父になる」の是枝裕和監督が、「歩いても　歩いても」「奇跡」に続いて阿部寛と3度目のタッグを組み、大人になりきれない男と年老いた母を中心に、夢見ていた未来とは違う現在を生きる家族の姿をつづった人間ドラマ。15年前に文学賞を一度受賞したものの、その後は売れず、作家として成功する夢を追い続けている中年男性・良多。現在は生活費のため探偵事務所で働いているが、周囲にも自分にも「小説のための取材」だと言い訳していた。別れた妻・響子への未練を引きずっている良多は、彼女を「張り込み」して新しい恋人がいることを知りショックを受ける。ある日、団地で一人暮らしをしている母・淑子の家に集まった良多と響子と11歳の息子・真悟は、台風で帰れなくなり、ひと晩を共に過ごすことになる。主人公の母親役を樹木希林が好演し、共演にも真木よう子、小林聡美、リリー・フランキーら豪華な顔ぶれがそろう。","2016年5月21日","2017-02-20 08:56:40","2017-02-20 08:56:40"
19,"ディストラクション・ベイビーズ","http://image.eiga.k-img.com/images/movie/82632/poster2/200.jpg?1457666272","真利子哲也","柳楽優弥、菅田将暉、小松菜奈、村上虹郎ら若手実力派キャストが集結し、愛媛県松山市を舞台に若者たちの欲望と狂気を描いた青春群像劇。「イエローキッド」「NINIFUNI」などで世界的注目を集める新鋭・真利子哲也監督が商業映画デビューを果たし、「桐島、部活やめるってよ」の喜安浩平が共同脚本を担当。愛媛の小さな港町・三津浜の造船所で暮らす泰良と弟の将太。いつもケンカばかりしている泰良は、ある日突然、町から姿を消し、松山の中心街で強そうな相手を見つけてはケンカを売るようになる。そんなある日、裕也という青年から声を掛けられた泰良は、裕也と一緒に通行人に無差別に暴行を加え、車を強奪。その車に乗りあわせていた少女・那奈も巻き込んで松山市外へと向かう。","2016年5月21日","2017-02-20 08:56:41","2017-02-20 08:56:41"
20,"少女椿","http://image.eiga.k-img.com/images/movie/84316/poster2/200.jpg?1455242124","TORICO","1984年の発刊以降、世界中でカルト的な人気を誇り、アニメ映画化や舞台化もされた丸尾末広による同名漫画を、短編映画「ミガカガミ」でモントリオールほか国内外の映画祭で注目されたTORICO監督のメガホンにより初の実写映画化。身寄りもなく、赤猫サーカス団に拾われた14歳のみどり。サーカス団に超能力を持ったワンダー正光が加入する。団員たちからいじめに遭うみどりを気にかけてくれるワンダー正光に心惹かれるみどりだったが、超能力で団員たちを従わせ、さらには殺害までするワンダー正光の姿に、その思いはやがて恐怖へと変わっていく。主人公・みどり役にはモデル、タレントとして活躍し、本作は映画デビューとなる中村里砂。「猫なんかよんでもこない。」の風間俊介、ロックバンド「SuG」の武瑠らが脇を固める。","2016年5月21日","2017-02-20 08:56:42","2017-02-20 08:56:42"
21,"機動戦士ガンダム THE ORIGIN III 暁の蜂起","http://image.eiga.k-img.com/images/movie/83518/poster2/200.jpg?1456369408","安彦良和","「機動戦士ガンダム」のキャラクターデザイナーとして知られる安彦良和が、同作をコミカライズした「機動戦士ガンダム THE ORIGIN」をアニメーション化。安彦自身が総監督、「機動戦士ガンダム0083」の今西隆志が監督を務め、「赤い彗星」ことシャア・アズナブルと妹セイラ・マスの過去を描くシリーズの第3話。宇宙世紀0074年、テキサス・コロニーを離れたエドワウ・マスは、身分を偽りシャア・アズナブルとしてジオン自治共和国国防軍士官学校に入学する。同期には仇敵ザビ家の末息子ガルマがいたが、2人は親交を深め、周囲にも一目置かれる存在へと成長してく。そして宇宙世紀0077年、学生たちが独立を掲げて武装蜂起する事態が発生するが……。","2016年5月21日","2017-02-20 09:41:38","2017-02-20 09:41:38"
22,"君がくれたグッドライフ","http://image.eiga.k-img.com/images/movie/84249/poster2/200.jpg?1454555127","クリスティアン・チューベルト","不治の病を宣告された男性が妻や仲間とともに旅を通じて命と向き合う姿を描いたドイツ映画。仲間とともに年に1回、自転車で旅をするハンネス、キキ夫妻。ALS（筋萎縮性側索硬化症）と宣告されたハンネスは、尊厳死の許されるベルギーへの旅を希望した。ハンネスが直面している現実を知り、友人たちはショックを隠せなかったが、ハンネスの願いどおりベルギーを目指すことを決意する。「ヴィンセントは海へ行きたい」でドイツ映画賞主演男優賞を獲得したフロリアン・ダービト・フィッツが主人公ハンネスを演じる。","2016年5月21日","2017-02-20 09:41:38","2017-02-20 09:41:38"
